<?xml version="1.0" encoding="UTF-8"?>
<country xmlns:vc="http://www.w3.org/2007/XMLSchema-versioning"
 xmlns:xsi="http://www.w3.org/2001/XMLSchema-instance"
 xsi:noNamespaceSchemaLocation="file:/home/zerokelvin/OxygenXMLEditor/samples/country.xsd" name="name0" langauage="langauage0" Area="0" Capital="Capital0">
    <state name="name1" state_id="ID000" Capital="Capital1" language="language0" coastal_area="coastal_area0" neighbours="ID000">
        <district name="name2" Area="0">
            <subdistricts>
                <rural>
                    <no_of_villages>50</no_of_villages>
                    <population>
                        <male>50</male>
                        <female>50</female>
                    </population>
                    <area>0</area>
                    <no_of_households>50</no_of_households>
                </rural>
                <urban>
                    <no_of_towns>50</no_of_towns>
                    <population>
                        <male>50</male>
                        <female>50</female>
                    </population>
                    <area>0</area>
                    <no_of_households>50</no_of_households>
                </urban>
            </subdistricts>
            <subdistricts>
                <rural>
                    <no_of_villages>50</no_of_villages>
                    <population>
                        <male>50</male>
                        <female>50</female>
                    </population>
                    <area>0</area>
                    <no_of_households>50</no_of_households>
                </rural>
                <urban>
                    <no_of_towns>50</no_of_towns>
                    <population>
                        <male>50</male>
                        <female>50</female>
                    </population>
                    <area>0</area>
                    <no_of_households>50</no_of_households>
                </urban>
            </subdistricts>
        </district>
        <district name="name3" Area="0">
            <subdistricts>
                <rural>
                    <no_of_villages>50</no_of_villages>
                    <population>
                        <male>50</male>
                        <female>50</female>
                    </population>
                    <area>0</area>
                    <no_of_households>50</no_of_households>
                </rural>
                <urban>
                    <no_of_towns>50</no_of_towns>
                    <population>
                        <male>50</male>
                        <female>50</female>
                    </population>
                    <area>0</area>
                    <no_of_households>50</no_of_households>
                </urban>
            </subdistricts>
            <subdistricts>
                <rural>
                    <no_of_villages>50</no_of_villages>
                    <population>
                        <male>50</male>
                        <female>50</female>
                    </population>
                    <area>0</area>
                    <no_of_households>50</no_of_households>
                </rural>
                <urban>
                    <no_of_towns>50</no_of_towns>
                    <population>
                        <male>50</male>
                        <female>50</female>
                    </population>
                    <area>0</area>
                    <no_of_households>50</no_of_households>
                </urban>
            </subdistricts>
        </district>
    </state>
    <state name="name4" state_id="ID001" Capital="Capital2" language="language1" coastal_area="coastal_area1" neighbours="ID000">
        <district name="name5" Area="0">
            <subdistricts>
                <rural>
                    <no_of_villages>50</no_of_villages>
                    <population>
                        <male>50</male>
                        <female>50</female>
                    </population>
                    <area>0</area>
                    <no_of_households>50</no_of_households>
                </rural>
                <urban>
                    <no_of_towns>50</no_of_towns>
                    <population>
                        <male>50</male>
                        <female>50</female>
                    </population>
                    <area>0</area>
                    <no_of_households>50</no_of_households>
                </urban>
            </subdistricts>
            <subdistricts>
                <rural>
                    <no_of_villages>50</no_of_villages>
                    <population>
                        <male>50</male>
                        <female>50</female>
                    </population>
                    <area>0</area>
                    <no_of_households>50</no_of_households>
                </rural>
                <urban>
                    <no_of_towns>50</no_of_towns>
                    <population>
                        <male>50</male>
                        <female>50</female>
                    </population>
                    <area>0</area>
                    <no_of_households>50</no_of_households>
                </urban>
            </subdistricts>
        </district>
        <district name="name6" Area="0">
            <subdistricts>
                <rural>
                    <no_of_villages>50</no_of_villages>
                    <population>
                        <male>50</male>
                        <female>50</female>
                    </population>
                    <area>0</area>
                    <no_of_households>50</no_of_households>
                </rural>
                <urban>
                    <no_of_towns>50</no_of_towns>
                    <population>
                        <male>50</male>
                        <female>50</female>
                    </population>
                    <area>0</area>
                    <no_of_households>50</no_of_households>
                </urban>
            </subdistricts>
            <subdistricts>
                <rural>
                    <no_of_villages>50</no_of_villages>
                    <population>
                        <male>50</male>
                        <female>50</female>
                    </population>
                    <area>0</area>
                    <no_of_households>50</no_of_households>
                </rural>
                <urban>
                    <no_of_towns>50</no_of_towns>
                    <population>
                        <male>50</male>
                        <female>50</female>
                    </population>
                    <area>0</area>
                    <no_of_households>50</no_of_households>
                </urban>
            </subdistricts>
        </district>
    </state>
    <Islands name="name7" Area="0"/>
    <Islands name="name8" Area="0"/>
    <Rivers name="name9" flows_through="ID000"/>
    <Rivers name="name10" flows_through="ID000"/>
    <Union_Territory name="name11" Area="0" langauage="langauage1"/>
    <Union_Territory name="name12" Area="0" langauage="langauage2"/>
</country>
